2.5.H.1.jpg; The picture is set in front of a green background. The picture is focused on a single eye. The eye is yellow with a black pupil in the center. The picture makes the viewer feel frightened and fearful. The picture conveys the feeling that the eye belongs to a creature that is powerful and dangerous. 
3.0.D.jpg;  A hand is seen holding a lighter in the image. The lighter is lit and a flame is coming from it. There are also tongs holding a piece of fabric. There is a small fire burning around the fabric.  The setting appears to be a simple setting with concrete floors. There appears to be a sense of danger. 
2.8.A.jpg; A man with dark hair is visible in the image. He has an intense look on his face. The man is looking at a large object in the image that is obscured by a black shadow. The man is facing the object with determination. iron arrows! above the man's head.  The man is feeling threatened but is still standing his ground. 
3.1.D.1.jpg; The image shows a long metal rod that is sticking out from the edge of the page and a part of a gear visible at the bottom of the page. The page has a dark background and the mood it conveys is of worry and anxiety. 
2.6.G.jpg; A black shoe is on the ground. The shoe is in a dark setting and is near the edge of the picture. The shoe looks powerful. The shoe looks as if it is about to step on something. The shoe looks confident. 
2.5.I.jpg; The picture is set in front of a dark blue background. The picture is focused on a close up of a green goblin with sharp teeth. The goblin is wearing a gold chain. The picture conveys the feeling of fear and dread. The picture makes the viewer feel like the goblin is about to attack. 
3.0.E.jpg;  A man with short brown hair and a black jacket is seen in the image. The man has his back to the viewer and is looking to the left. His left arm is leaning against a wall. The man appears to be feeling uncomfortable and is trying to stay composed.  The setting appears to be an alleyway. you have been burned. you are now stunned. above the man. your 'cold blooded' nature will keep you composed. below the man. 
3.1.E.jpg; A man with brown hair is visible wearing a black jacket with a white mask over his face.  The man has a worried expression on his face and is looking up. The image has a dark, mysterious feeling.  i found it! above his head. 
2.8.B.jpg; A man wearing a black jacket and a white mask is standing in a dark alley. The man is holding a large backpack that appears to have several arrows sticking out of it. The man is using the backpack to shield himself from incoming danger. The man is thinking to himself.  i need to stick to the wall and lessen my body exposure as much as possible. above the man's head. The man is feeling tense and worried. 
2.7.A.0.jpg; A white blur is visible in the image. The blur is moving from the top left to the bottom right of the picture. The blur looks fast and is creating a wind effect. The blur is heading for a dark area. The blur looks strong. you have now entered block a. disarm or destroy all the traps in this block. above the blur. 
3.1.F.0.jpg; The picture shows a dark room with a white line and a small hole visible in the middle of the page. The picture has a dark and mysterious feeling. 
3.0.F.jpg; A man wearing a white mask, a black jacket and pants is seen walking towards the right side of the image. He is carrying two knives in his right hand.  The setting appears to be a dark alleyway. The man appears to be feeling determined. you are no longer stunned. you have developed a resistance to burn. above the man. 
2.6.A.jpg; The picture is set in front of a dark blue background. The picture is focused on two texts. The text on the top says "the tower grows the foundation of the player's work." The text below the top text says "as your contributions increase and your work becomes more noteworthy, the way your score is calculated will be adjusted separately so there is no need to worry." The picture makes the viewer feel like they are learning about a system where work is being rewarded. The picture conveys the feeling that the viewer is learning how the tower grows based on the work the player does.  
2.8.C.jpg; A man wearing a black jacket and blue jeans is running down a dark corridor. The man is carrying a large,  bladed weapon. The man has a determined look on his face. The man is moving at a fast pace.  The feeling is one of action and urgency. 
2.7.A.1.jpg; A man with black hair is wearing a black hooded jacket, a white mask, a black backpack, and blue jeans. The man is running away from a sharp object. The man looks scared and is trying to escape the object. The man looks shocked. 
3.1.F.1.jpg; The picture shows a man with brown hair.  He is wearing a black jacket and a backpack. He is walking away from the reader and up a set of stairs. The picture has a mysterious and eerie feeling. 
3.0.G.jpg;  Two men wearing white masks and black jackets are seen in the image. The man in the front is facing the viewer and has short brown hair. He is looking forward. The man in the back is partially visible, has short brown hair and is looking to the left. The man in the back is sitting and leaning to the right. The man in the front is standing and looking straight ahead. The setting appears to be a dark environment. The men appear to be feeling serious.  when the arrows were shot at me, it was timed. above the men. there was also a very faint signal too. below the men. 
2.8.D.0.jpg; A man wearing a black jacket and a white mask is visible in the image. He has a wide-eyed, shocked expression on his face. The man is looking up with a look of fear and surprise. The man is in a dark and gloomy setting. The man is feeling threatened and scared.  
2.6.B.jpg; The picture is set inside a building with dark blue walls. A green goblin with large ears is in the foreground wearing a black suit and a monocle. The goblin is looking at a man in the background. The man has short, black hair and is wearing a black hoodie. The man is looking at the goblin. A text above the goblin says "usually, these types of players go one of two ways." A second text above the goblin says "they either believe solely on their skill and die while acting high and mighty." A text below the man says "i see." The picture conveys the feeling of danger and suspense. The picture makes the viewer feel like the man is in a dangerous situation. 
3.1.G.jpg; The picture shows a knife that is sticking out of a dark surface and surrounded by black lines. The picture has a dark, mysterious and scary feeling. 
2.7.B.0.jpg; A translucent man is running through a hallway. The man is wearing a black jacket and a white mask. The man is dodging traps that are in the hallway. The man is moving fast and looks like he is in danger. The man looks determined and focused. the journal did warn me about block a having a lot of traps. above the man. however, since the location and trigger mechanism for these traps is unknown, that knowledge wasn't a big help. below the man. 
3.1.A.jpg; A man with short brown hair wearing a white mask and a black jacket is seen looking up towards the left side of the image.  The setting appears to be a dark environment. The man appears to be feeling determined.  i need to find the right timing. above the man. finding where the arrows are with the naked eye won't be possible because it is dark. below the man. i need to listen for when the cogwheel turns. below the man. 
2.8.D.1.jpg; A man in a black jacket and a white mask is falling backward. The man has a look of shock and fear on his face. He appears to be injured. The man is in a dark and gloomy setting.  The feeling is one of intense action and danger. 
2.6.C.0.jpg; The picture is set in front of a dark blue wall with white squares. The picture shows text above the center of the image that says "or they become a sight to see." A text below the top text says "if that is what you mean then i will begin the trial immediately." The picture makes the viewer feel like a challenge is about to begin. The picture conveys the feeling of excitement and suspense. 
3.2.A.0.jpg; The picture shows two metal rods on the floor that are crossed over each other.  They are both sharp and have red tips. There is a dark background with a dark feeling. 
3.1.B.jpg; The image is of a large rusted gear with a single hole in the middle. The setting appears to be in a dark environment. The image gives off a sense of mystery and suspense.  that is the perfect time to find out the arrow's location and trajectory. above the gear. during that short period of time, i need to listen for the exact sound that it makes. below the gear. 
3.2.C.jpg; A man with dark hair is visible in the picture. The man has a white mask covering his face. The man has his back to the viewer. The man is wearing a black jacket with a hood. The man has his right arm raised. In the man's left hand there is a blue arrow pointing to the right. The man is in a blue area and moving to the right. The image conveys a sense of action and speed.  your agility has gone up by 1.  below the man. 
3.0.A.0.jpg; A man with dark hair is standing in a dark alley. The man is wearing a white mask and a black jacket. He has a pained expression on his face. extreme pain has overcome your body. you are now stunned. above the man's head. your 'cold blooded' nature will keep you composed. below the man's head.  The man is feeling hurt and slightly dazed but is trying to stay strong. 
3.2.A.1.jpg; The image shows a man with brown hair wearing a black jacket and a white mask. The man is looking down at two metal rods on the floor.  The picture has a dark and mysterious feeling.  that's it. above his head.  i can find it now. below his head. 
3.3.G.jpg; A green-skinned creature is visible in the image. The creature has large ears. The creature is facing forward with its mouth closed. The creature is inside a dark room. i feel like a lot of fun spectacle will arise during this tutorial. above the creature. The creature appears to be smiling. The creature looks eager and excited. 
3.1.C.jpg; A man with short brown hair is seen in the image. He is wearing a white mask. The man has his eyes closed. The setting appears to be a dark environment. The man appears to be focused and alert. heightened senses. above the man. 
3.2.D.jpg; A man with dark hair is visible in the picture. The man is wearing a black jacket with a hood, and a white mask over his face. The man is holding a dagger in his right hand. The man has a red arrow embedded in the blade of the dagger.  The man is looking to his left. The man is standing in a blue area and there are several diagonal lines coming from the left side of the image. The image conveys a sense of danger and excitement. your strength has gone up by 1.  is visible in the top left corner of the picture. 
3.4.A.jpg; A green-skinned creature is visible in the image. The creature is wearing a black suit and a bow tie. The creature has a monocle in its right eye. The creature is looking down at a grid of images. Each image is in black and white and contains one or more people. oh hyo hyo hyo. above the grid of images. The creature is looking at the images with interest. The creature appears to be amused. 
3.2.B.0.jpg; The picture shows a man with dark hair in a dark jacket.  He is holding a sword with his right hand and has a determined look on his face. The picture has a mysterious and exciting feeling.      above his head. 
3.5.A.jpg; A man is wearing a black hoodie, black pants, and black shoes. He has a backpack on his back. His left hand is visible and he is holding a sword. A yellow glow around him makes it look like he is injured.  There is a bandage on his right thigh. He is standing on a dark floor. The man looks determined and focused.  The feeling is one of anticipation, as the man is walking towards something. 
3.3.A.0.jpg; A man with dark hair is visible in the picture. The man is wearing a black jacket with a hood. The man is wearing a white mask over his face. He is holding a knife in his right hand. A yellow arrow has hit the man in the chest. The man is in a blue area and the picture conveys a sense of action and danger. getting hit by a yellow arrow will increase stamina. below the man. your stamina has gone up by 1.  is visible below the man. 
3.4.B.0.jpg; There is a rectangular box in the image. The box contains the title cha yeon-woo at the top. It also contains the text nature: cold-blooded strength: 29 agility: 33 stamina: 30 mp: 21 dragon visual prowess 0.0%, heightened senses 8.3%, clairvoyance 0.0%. below the title. The box is set against a dark background. The text in the box is in a white font.  you have reached the end point. above the box. except for mp, all the other below the box. The box is highlighted in blue.  
3.6.D.0.jpg; A man is visible wearing a gray hooded robe. He is smiling. The man is holding a blue and silver object. The man is in a dark room. The man is looking at a person who is not in the frame. The man is in the foreground of the image. The text "after coming this far, did something that you really need come to mind, sir?" is above the man. starting from commonplace food, potions, skillbooks, and even all kinds of artifacts. a merchant who sells everything in the world. is above the text. The image conveys a sense of wonder and intrigue. The man looks confident and possibly in control of the situation. 
3.5.B.jpg; A man with short brown hair is wearing a black jacket, a white mask, and a black backpack. He is standing next to a grey wall with yellow energy trails around him. i can finally catch my breath now... above his head. The man looks calm and collected. The feeling is one of relief, as the man has just escaped a dangerous situation. 
3.2.B.1.jpg; The picture shows a man with brown hair and a white mask. He is holding a knife in his right hand and is running. There is a dark background and he appears to be moving very fast. 
3.3.A.1.jpg; A man with dark hair is visible in the picture. The man is wearing a black jacket with a hood and a backpack. The man is walking to the left. The man's face is not visible. The man is standing in a dark area.  the more i accumulate the more i can achieve with my job.  is a white text bubble above the man. profile: cha yeon-woo. is a white text box below the man. nature: cold-blooded. strength: 19. agility: 19. stamina: 14. mp: 21. skills: dragon visual prowess 0.0%. heightened senses 4.3%. clairvoyance 0.0%. are in a blue box in the middle of the image. where else is there a place like this. is a white text bubble below the man.  The picture conveys a sense of mystery and wonder. 
3.6.D.1.jpg; A blue glowing screen is visible with blue text. The text "i'm a merchant who sells everything that exists in this world." is in a white text at the bottom of the screen. The text "if you are in need of something, please let me know." is below the text. The screen has many white boxes and a few rows of text. The image conveys a sense of power and mystery. The text suggests that the merchant is powerful and able to provide anything. 
3.4.B.1.jpg; A man is standing in front of a door. The man has black hair and is wearing a black jacket. The man is wearing blue jeans and a black belt. The man is wearing a backpack. The man is looking at a screen in his hand. stats have substantially gone up. above the man. going up this much in a day is a pretty good outcome. above the man. The man is standing in front of the door with his feet slightly apart. The man is looking at the screen with a look of satisfaction. The man looks happy and proud. 
3.5.C.jpg; A man with short brown hair is wearing a black jacket. He is lying on the ground with his back to the viewer. His black jacket is visible as well as his right arm and a backpack. The man is surrounded by yellow energy trails.  He is lying next to a grey wall.  The man looks unconscious and injured. The feeling is one of fear and worry, as the man has been hurt in a fight. 
3.6.E.jpg; A man with black hair is visible. He is wearing a black jacket and a white mask. The man is looking at a blue screen with white text. The man's right hand is visible and he is holding the screen. The text "hmm..." is above the man. The image conveys a sense of curiosity and intrigue. The man is thinking about something and is trying to understand what he sees on the screen. 
3.3.B.jpg; A man with dark hair is visible in the picture. The man is wearing a white mask over his face and a black jacket with a hood. Blood is dripping from the man's mouth. The man has his right hand raised and fingers spread out. The man is standing in a dark area. The picture conveys a sense of horror and shock. 
3.5.D.jpg; The image is a black background with white text in the center. The feeling is one of suspense and anticipation, as the viewer is waiting to see what will happen next. 
3.4.C.jpg; A man with brown hair is visible in the image. The man has a black mask over half his face. The man is wearing a black hoodie. The man is standing against a wall. and it's not just that. above the man. The man's eyes are visible. The man is looking straight ahead. The man is standing still with a stoic expression. The man looks determined and serious. 
3.7.B.jpg;  Two characters are visible in the image. The first character is a man with dark hair.  He is wearing a black suit and a white mask that covers his eyes. He is pointing with his right hand to a menu. The second character is a woman with dark hair. She is wearing a hooded garment and is smiling. The characters are standing in a dark room. There is a sense of mystery and intrigue, as the characters are both masked. The man seems hesitant and wary, while the woman seems confident and welcoming.  yes, what would you like. above the woman's head. there is something i would like to purchase. above the man's head. 
3.6.F.0.jpg; A glass bottle containing a green liquid is floating in the air. A yellow horn is also visible at the bottom. The text "medusa's venom" is above the bottle. The text "golden goat's" is below the horn. The image conveys a sense of danger and mystery. The items are powerful and dangerous. 
3.7.C.jpg; A woman with dark hair is visible in the image. She is wearing a hooded garment.  She has her hands clasped in front of her and a small smile is visible. The woman is standing in a dark room. There is a sense of mystery and intrigue as the woman's face is obscured by the hood. The woman appears to be confident and calm, which creates a sense of anticipation and intrigue.  by offering all of the stats i accumulated in block a as payment. above the woman's head. 
3.3.C.jpg; A man with dark hair is visible in the picture. The man is wearing a black jacket with a hood. He has a white mask over his face. The man has his right hand raised and his fingers spread out. There is blood on the man's left hand. The man is in a blue area. The picture conveys a sense of thoughtfulness and determination. one thing that bugs me is that there is no way to increase my mp stat. is a white text bubble above the man. even so, if i can take advantage of this and steadily increase the stats that i want.... is a white text bubble below the man. 
3.4.D.jpg; A man with brown hair is visible in the image. The man has a black mask over half his face. The man is wearing a black hoodie. The man is wearing a backpack. The man is looking down at his hands. my physical strength, mobility, endurance, and destructive power have all around gone up. above the man. The man's eyes are visible. The man is clenching both of his fists. The man is standing still with a determined expression. The man looks strong and powerful.  
3.5.E.jpg; A man is wearing a white hoodie. His face is not visible but he is smiling with his eyes closed and his hands are up as if to say hello. peek-a-boo? above his head. The man looks friendly and welcoming.  The feeling is one of intrigue, as the viewer is curious to see what the man is hiding. 
3.6.F.1.jpg; A giant blue eye is in the center of the image. The eye is floating in the air. The text "tiamat's left eye..." is to the right of the eye.  A golden horn is visible in the top right corner of the image. The image conveys a sense of power and awe. The eye is incredibly powerful and the horn is a valuable item. 
3.7.D.0.jpg; A man with dark hair is visible in the image.  He is wearing a black suit and a white mask that covers his eyes.  The man is standing in a dark room. The man seems determined to have the ticket, as the image conveys a sense of determination and resolution. i would like to purchase a ticket that will reset block a. above the man's head. 
3.3.D.jpg; A man with dark hair is visible in the picture. The man is wearing a black jacket with a hood. The man is wearing a white mask over his face. The man has blood on his left hand. The man is in a blue area. The picture conveys a sense of pain and discomfort. oh hyo hyo hyo.  is a white text bubble to the right of the man.  
3.4.E.jpg; A man with brown hair is visible in the image. The man has a black mask over half his face. The man is wearing a black hoodie. The man is wearing a backpack. The man is reaching out his left hand. The man is facing away from the viewer. The man's eyes are visible. The man is walking forward. The man looks determined and focused. 
3.5.F.jpg; A man with short brown hair is wearing a white mask and black clothing, He is sitting on the ground.  A man wearing a white hoodie with his arms raised is standing behind him. The man in the hoodie has a surprised look on his face and looks confused. They are standing on a dark floor. The feeling is one of surprise and disbelief, as the man in the hoodie has just seen something unexpected. 
3.7.D.1.jpg; A man with a black hoodie and a white mask is visible in the image. He is wearing a black hoodie. He is standing with his arms crossed. The man is standing in a dark room. The man appears to be confident and in control, which creates a sense of power and mystery. 
3.6.G.jpg; A man with black hair is visible. The man is wearing a white mask and a black jacket. The man is looking at a blue screen. The text "there is no way a tutorial player could acquire these types of items." is at the top of the image. The text "i'm not at the stage where i can rely on artifacts or skills." is in text above the man. The text "let's just focus on physical training." is in text below the man. The image conveys a sense of determination and focus. The man is serious about his training and is not going to rely on cheap tricks. 
3.3.E.0.jpg; A man with green skin and pointy ears is visible in the picture. The man is wearing a black suit with his arms crossed. He is looking to the right. The man is standing in front of several screens that are displaying different images. The man is looking at the screens. The screens are in a curved shape and they are in front of a dark background. The picture conveys a sense of intrigue and curiosity. the more i observe him the more interesting he becomes. is a white text bubble above the man. i feel like he is the character who is the first of his kind. is a white text bubble to the right of the man. 
3.4.F.jpg; A man with brown hair is visible in the image. The man has a black mask over half his face. The man is wearing a black hoodie. The man is looking down. treatment of your wounds will now begin. above the man. The man's eyes are visible. The man is standing still with a worried expression. The man looks nervous. There are yellow lights around the man. 
3.5.G.jpg; A man with short black hair is wearing a black jacket and black pants. He is looking down with a confused look on his face. His left hand is holding a gun.  He is standing next to a man wearing a grey hoodie who is looking up with a confused look on his face. He has his arms raised.  Both men are standing on a dark floor. this person, who is he? above the man in the black jacket. i'm sure my heightened senses skill was still in effect.  below the man in the black jacket. how did i not notice that he was next to me. to the left of the man in the grey hoodie. The feeling is one of surprise and confusion. 
4.0.A.jpg; Two characters are visible in the image. The first character is a woman with dark hair.  She is wearing a hooded garment and is holding a menu. The second character is a man with dark hair. He is wearing a black suit and a white mask that covers his eyes. He is looking at the menu with a backpack on his back.  The characters are standing in a dark room. The man seems to be examining the menu, while the woman appears to be confident. The image conveys a sense of mystery and intrigue. are you talking about a reset ticket? above the man's head. that's right. above the woman's head. 
3.6.H.jpg; A man with black hair is visible. The man is wearing a white mask and looking at something in the distance. The text "i found it." is above the man. The image conveys a sense of excitement and satisfaction. The man is happy with what he has found. 
3.3.E.1.jpg; A man with green skin and pointed ears is visible in the picture. The man is wearing a black suit with a white shirt underneath. He is wearing a monocle on his right eye. The man is holding his chin with his right hand. The man is looking down and to the right. The man is standing in a blue area. The picture conveys a sense of thoughtfulness and intrigue. strangely, my eyes are more drawn to the person in block a who has his hands full than the people in block e. is a white text bubble above the man. this guy is the real one for sure. is a white text bubble below the man. 
