18.11.C.jpg; Two men are shown in a room with a table between them. The man on the left is giving a thumbs up to the man on the right. The man on the left is wearing a dark blue jacket with the words republic of korea hunter on the back. The man on the left is also wearing a dark blue shirt with a South Korean flag on the front. The man on the right is wearing a dark blue jacket with the words republic of korea hunter on the back. The man on the right is also wearing a white shirt with a dark blue collar.  The man on the left is smiling and excited. The man on the right is looking at the man on the left with a curious expression. The image conveys a feeling of excitement and interest. i heard it directly from the instructors above the men. 
18.8.E.jpg; A man with dark blue hair is sitting in a chair, looking at the viewer. He is wearing dark blue clothing with a white circle on the left side of his chest. The man has a serious expression. The scene feels serious and tense. 
18.12.C.jpg; Two characters are visible in the image. One of the characters is wearing a dark suit and a white shirt. The character has a patch on their sleeve with the South Korean flag on it. The character is holding their hands up and looks scared. The second character is standing behind them and is holding their hands up. The characters are in an indoor setting and it looks like a hallway. The first character looks like they are having an outburst and is looking scared and afraid of the second character. The feeling is that the first character is trying to explain something, but the second character does not believe them. why the sudden outburst? you weren't scared a while ago. you punk!! above the first character's head. 
18.9.E.jpg; A man and a woman are visible in the image. The man is wearing a black jacket with white stripes and is sitting with his hands on a table. The woman is standing next to the man. She has long blonde hair and has an angry expression. The man has a confused expression. The man and woman are in an indoor setting. The man is saying that the medical team praised his first aid skills and that they said it was excellent. The woman is standing with her fists clenched and seems to be very annoyed.  the medical team praised my first aid skills. they said it was excellent, you know? above the man's head. i've never said miss joyeon couldn't do it, have i? below the man.  The picture conveys a sense of anger and frustration. 
18.7.B.0.jpg; A woman with brown hair is looking down at a man with glasses. She has a serious expression. The woman is wearing a dark tracksuit. The picture conveys a sense of concern and seriousness. this is his fourth seizure this week. i need to tell the instructor. above the woman. 
18.11.D.jpg; Two men are shown sitting at a table. The man on the left is looking down at his drink with a worried expression. The man on the left is wearing a white shirt and a dark blue jacket with white accents. The man on the left is also wearing glasses. The man on the right is sitting to the right of the table. The man on the right is wearing a black shirt and a black jacket. The image gives off a feeling of nervousness and anxiety.  gotat... i'm kind of scared of that guy... above the men. why? maybe he looks down on you because you're from ulleungdo? below the men. 
18.12.D.0.jpg; One character is visible in the image. The character has brown hair and is wearing glasses. They are wearing a dark jacket over a white shirt.  The character has their hand up and is touching the side of their glasses. The character is in an indoor setting. The character looks excited and happy. The picture conveys a feeling of excitement and that the character is looking forward to something.  i-i'm sorry. my goal is also to join the silver lion guild, too... above the character's head. it's the place that has the deepest connection with 'jyo'. below the character's head. 
18.9.A.jpg; A woman is standing in front of a man who is sitting in a chair. They both have a serious expression. The woman has long brown hair and is wearing dark blue clothing with white stripes down the sides. The man is wearing dark blue clothing with a white circle on his chest. The woman is holding her hand on her waist. The man is holding a cup. The scene feels serious and tense. you know your roommate collapsed earlier, right? is above the man. 
18.10.A.jpg; A man and a woman are visible in the image. The man is sitting at a table and looking to the right. He has a confident expression. He is holding a phone in his left hand. The woman is behind the table and holding a phone in her left hand. She has a shocked expression and is looking to the left. The woman has long blonde hair. They are in an indoor setting. The man is saying that he knows if the woman is beating around the bush. The woman is reacting to a text message. did you think i wouldn't know if you beat around the bush like that?! above the man's head. oh, wait a moment. i just got a text message... below the man's head. The picture conveys a sense of confrontation and suspense. 
18.13.D.1.jpg; A man with short dark hair is visible in the image. The man is wiping his forehead with a white towel. He is wearing a dark blue jacket with white stripes on the sleeves. He has a pained expression on his face. He is in an indoor setting. A circular text is below him. The man is wiping his forehead and looks distressed. The text indicates that the man is having second thoughts and thinking about a different approach. instead of getting a rival, think about how to become friends with him. below the man. 
18.12.D.1.jpg; A lion with blue fur is visible in the image. The lion has a glowing golden eye. The lion is roaring. There is a crown in the background.  The lion looks like it is in an outdoor setting. The image makes the viewer feel like the lion is powerful and commanding.  marketing and legal response are all handled by them. above the lion. 
18.11.E.jpg; A man with brown hair is shown looking at text above him. The man is in a room with a table. There are two chairs behind the man. The image gives off a feeling of astonishment. he's from ulsan, right? he's acting all high and mighty. like a seoul bumpkin above the man. they say he's the highest scorer in tutorial history. it is the first time in history that someone's score exceeded 30,000... below the man. 
18.10.B.jpg; A man and a woman are visible in the image. The woman is in a chibi form and has long blonde hair and an annoyed expression. She is looking to the left. The man is looking to the right. He is in a chibi form and has a confused expression. They are both in an indoor setting. The man is asking if the text message is from the woman. it's not miss jyo, is it? above the man's head.  The picture conveys a sense of surprise and confusion. 
18.15.C.1.jpg;  The golden rule, honghae.  above the sun. The image has a large sun with an eye in the middle surrounded by rays of light. The sun is an intricate design and has multiple rays coming off of it in an almost starburst formation. The background is also a bright yellow and has a dark, almost black, gradient to it. There are also intricate patterns that look like stars or more rays of light coming from the centre of the sun. The setting is a very important event and is very powerful, with the sun being a key symbol. The overall feel is mysterious and mysterious, the large eye in the middle of the sun makes the viewer question who the image is addressed to. 
18.14.A.jpg; A man with dark hair is visible in the image. The man is wiping his forehead with a white towel. He is wearing a dark blue jacket with white stripes on the sleeves. The man is in an indoor setting. A circular text is above the man. The man looks very concerned and shocked.  The text indicates that the man thinks his rival will not talk to him first. there's no way he'll be the one to talk to you first from his side... above the man. that... below the man. 
18.13.A.0.jpg; One character is visible in the image. The character is wearing a dark suit and a white shirt. The character has white hair and is looking away from the viewer. The character is in an indoor setting. The character looks serious. The picture makes the viewer feel like the character is determined to do something.  if i go there, i might be able to see him in person. above the character's head. 
18.11.F.jpg; A man with brown hair is wearing glasses. The man has an open mouth and seems to be in shock. The man has a dark blue jacket on. The man looks like he is surprised by something. The man is in a casual setting. The image gives off a feeling of shock. 
18.14.B.jpg; A man with short brown hair is visible in the image. The man is wearing square framed glasses. He is wearing a dark blue jacket over a white shirt. The man is in an indoor setting. He looks concerned. A circular text is above him. The man is looking at another man in the background. seongtaek hyung? what's wrong? above the man. 
18.10.C.0.jpg; A man with black hair is visible in the image. Only the face of the man is visible. He has a thoughtful expression. The man is in an indoor setting. The man is reading a text message about his assigned roommate. it's from the training center operations team. it's about my new assigned roommate. above the man's head. so, his name is... below the man's head. The picture conveys a sense of anticipation and curiosity. 
18.13.A.1.jpg; Several characters are visible in the image. They are wearing dark suits and white shirts. The characters are all standing in a line and have their backs turned towards the viewer. The characters are in an outdoor setting. The characters look like they are in a difficult situation and do not know what to do.  The picture makes the viewer feel like the characters are in a difficult situation and are concerned about the outcome of something. but if baek dohyun goes to the silver lion too... it will be very hard for me. above the character's heads. 
18.16.A.0.jpg;  a small piece of the puzzle from a world in disarray. above the two characters. There are two characters in the image. The character on the left is a young man with short, grey hair. He is wearing a navy blue and white tracksuit with the South Korean flag on the left breast of his jacket. He is holding out his hand to a young man who is dressed in a similar outfit to the man on the left, but black and white, and on the back of his jacket is the text republic of korea hunter. The young man on the right is leaning on a glass panel. The character on the left appears to be offering his hand to the other man, but he has his face down and his eyes closed. The setting is very light with a blue hue. The image is suggestive of a bond between two people, likely related to their work as hunters. The overall feel is one of caution and anticipation, as the two characters are trying to be careful in the situation they are in. 
18.12.A.jpg; A man's eye with a golden iris is visible. The man is shown with brown hair. The man's eye is glowing brightly. The image gives off a feeling of anticipation and interest. he must have had a very high level of commitment. above the man. i heard that since 'jyo' is his relative, she might take him to silver lion guild. below the man. 
18.14.C.0.jpg; A man with short brown hair is visible in the image. He is wearing a dark blue jacket over a white shirt. He is wearing square framed glasses. He looks concerned. A man with short dark hair is visible in the image. He is wearing a dark blue jacket over a white shirt. The man is looking at the man with glasses. He has a confident smile. The men are in an indoor setting. A circular text is above the man with short dark hair. The man with short dark hair is questioning the man with glasses. The man with glasses looks concerned and worried. He is surprised to see the man with dark hair.  you're honghae. right? above the man. 
18.16.A.1.jpg; dohyun made up his mind. above the feet of the character on the right. this time, before this piece is sadly shattered, below the feet of the character on the right. The image is of the feet of a character dressed in a black and white tracksuit. The character is wearing black shoes. The setting is a white, almost empty, room.  The image is a warning to the viewer that something is about to happen, the text in the image indicates that a decision has been made. The overall feeling is one of tension and anticipation, as the reader knows something important is about to happen. 
18.10.C.1.jpg; A man with black hair is visible in the image. Only the face of the man is visible. He is looking down and smiling. He is holding a phone in his hand. The man is in an indoor setting. The man appears to be intrigued by something. The picture conveys a sense of intrigue and curiosity. 
18.13.B.jpg; One character is visible in the image. The character is wearing a dark jacket and has a patch on their sleeve with the South Korean flag on it. The character is wearing glasses and is holding a cup with their hand. The character is in an indoor setting. The character is sitting at a table. The character has a confused look on their face. The picture conveys a feeling of confusion and disappointment.  are you treating him as your rival? bro you said you're not even in the same class. above the character's head. 
18.14.C.1.jpg; A man with short brown hair is visible in the image. He is wearing square framed glasses. He is wearing a dark blue jacket over a white shirt. He has a concerned expression on his face. He is in an indoor setting. A circular text is below him. There is a large, faded image of a person behind the man. The image of a person in the background suggests he is having thoughts about a certain person. The man is responding to someone.  yes... below the man.  inner thoughts  to the right of the man. 
18.12.B.0.jpg; A man with brown hair is shown looking at text above him. The man is wearing glasses and is smiling and shocked. The man is in a casual setting. The image gives off a feeling of excitement and anticipation. silver lion guild...? above the man. 
18.16.B.0.jpg;  The character has white hair and is wearing a long, green robe with a brown hood pulled over their head. They are holding a glowing orb of light in their hands. They look calm and focused. The setting is a dark, almost black background. The background has a faint purple hue to it, and there is a light pattern of stars in the background. There is an intricate design behind the character that resembles a crown.  The character looks powerful and powerful, the light that the character is holding has a mystical aura to it. The overall feel is one of hope and anticipation, as the character has a glow of energy surrounding them. 
18.13.C.0.jpg; Several characters are visible in the image. The characters are wearing dark suits. The characters are in an indoor setting. The characters are looking up. The characters look like they are in a difficult situation and do not know what to do. The picture makes the viewer feel like the characters are in a difficult situation and are concerned about the outcome of something.  can't you tell just by looking at him? he is at least a-grade! it's written all over his face. above the characters' heads. 
18.17.C.0.jpg; A man with blue hair is visible in the image. The man is looking down.  A large white cloud is behind the man. The man is looking towards the left side of the image.  The picture conveys a feeling of shock and surprise. 
18.15.A.0.jpg; A man with dark blue hair is visible in the image. He is wearing a dark blue jacket with white stripes on the sleeves. He is wearing a white shirt underneath. The man is in an indoor setting. He has a warm smile. A circular text is above him. The man is introducing himself to another character. The man looks happy and excited. nice to meet you. i'm baek dohyun, your roommate from today. above the man. 
19.1.C.0.jpg; A character is visible wearing a hat. The hat is covering their forehead and their eyes are not visible. The hand of the character is visible in the bottom half of the image, but their face is obscured. The character is looking towards the right, with their hand near their chest. you mad dog. i really am a bad guy. have you realised it just now? above the character. The image is of a character admitting to being a bad guy and that the character has been bad all along. The image is showing a moment of vulnerability for the character as they confess this.  
18.17.C.1.jpg; A man with blue hair is wearing a white shirt, gray pants, a white bucket hat and sunglasses. He is looking to the right. He is wearing a turquoise earring in his left ear. The man has his left hand on his right shoulder. The picture conveys a feeling of joy, peace, and confidence. 
18.16.B.1.jpg; he will lead him to his beloved little queen. above the character. The character in the image is wearing a black jacket with an orange shirt and shorts underneath, and black shoes. The setting is a dark, almost black background. The background has a faint purple hue to it, and there is a light pattern of stars in the background. There is an intricate design behind the character that resembles a crown. The character looks powerful and determined, the character's actions seem to suggest the importance of their journey. The overall feeling is one of hope and anticipation, the character looks like they are about to embark on a journey to reunite two people. 
18.13.C.1.jpg; One character is visible in the image. The character has blue hair. The character is wearing a dark jacket. The character is smiling. The character is standing in a line of other characters. The characters are in an indoor setting. The picture makes the viewer feel like the character is confident and ready for something. republic of korea hunter on the character's back. 
18.15.A.1.jpg; A man is visible in the image. Only his arm and hand are visible. He is wearing a dark blue jacket with white stripes on the sleeves. He is in an indoor setting. His hand is extended towards the viewer. A circular text is above the man. The man looks friendly and open. He wants the viewer to take care of him. please take care of me. above the man. 
19.1.C.1.jpg;  A character with blue hair is visible. Only the top half of their face is visible. The character is wearing a light blue shirt. They have a smirk on their face and appear to be looking down with a gleam in their eyes. The character is in a relaxed setting. They are smirking suggesting that they are enjoying themselves or pleased with something. luascans.com in the bottom left corner of the image. 
18.17.D.jpg;  A man with blue hair is visible in the image. He is looking at the viewer. The man is wearing a gray jacket. The setting is a dark, mysterious area.  The man is looking towards the viewer. The picture conveys a feeling of mystery and intrigue. read at luascans.com for the fastest releases! join our discord we're recruiting! korean translators and proofreaders! join our discord for more details. discord.gg/ntuc9zbybd  above the man. luascans.com below the man. 
18.16.C.0.jpg;  The image is of a light blue sky with a white light in the centre of the image. The light appears to be reflecting off a water surface.  The image is a beautiful representation of the world in a state of peace.  The overall feel is one of calm and peace, a sense of peace and hope for the future. 
18.15.B.0.jpg; A man with short brown hair is visible in the image. The man is wearing square framed glasses. He is wearing a dark blue jacket over a white shirt. The man is in an indoor setting. He has a large smile. The man looks happy and enthusiastic. 
19.2.A.0.jpg; There is text in the middle of the image. The text is saying "there are different kinds of bad guys, and you seem more shady and sneaky!!" below the text is another text saying "that hurts my feelings, bro." The image is of someone insulting another character. The character is clearly upset by what they were just told and they look like they might be about to cry. 
18.13.D.0.jpg; One character is visible in the image. The character has brown hair and is wearing a dark jacket. The character is in an indoor setting. The character is looking down. The character looks confused. The picture makes the viewer feel like the character is confused and does not know what to do. as soon as registration is over, the scouts will line up and shout for baek dohyun! baek dohyun! below the character's head. 
19.0.A.0.jpg; The image shows a blue sky with bright sunlight shining down. There is a small white cloud at the bottom of the picture. There are music notes in a circle at the bottom of the image. The picture conveys a feeling of peace, joy, and tranquility. 
18.16.C.1.jpg;  The image is of a light blue sky with two white lights at the top of the image. There is a music note symbol floating in the sky with a white background. The music note is floating near the bottom of the image.  The image is of a calm day, with the blue sky and bright lights representing a sense of hope.  The overall feel is one of joy and happiness, a moment of peace and calm in a busy world. 
19.0.A.1.jpg; The image shows a white building in the background with a blue ocean and beach. The buildings are on a beach in the foreground. The sun is shining on the water, making it shimmer. The picture conveys a feeling of peace, joy, and tranquility. luascans.com below the image. 
18.15.B.1.jpg; A man with short dark hair is visible in the image. Only his hand and arm are visible. He is wearing a dark blue jacket over a white shirt. He is in an indoor setting. He is looking at the viewer and smiling. A circular text is below him. The man is asking for the viewer to take care of him. alright please take care of me. dohyun. hyung. below the man. 
19.2.A.1.jpg; A character with dark brown skin, is visible. The character has white hair with black strands in it. The character is wearing a white tank top and black shorts. Their body is positioned at a slight angle, while they are holding a red can to their mouth. They are looking at the character on the right with a disgusted look on their face. The character on the right, has blue hair and is wearing a white shirt, a blue bucket hat, and sunglasses. They are looking at the other character with their hands folded in front of their chest and a confused expression. The image is showing one character being annoyed at the other. The character on the left is insulting the other character with the text saying "stop acting like you're so fragile! you damn bastard! you're making me feel sorry!". The image conveys a feeling of annoyance and disgust. 
19.3.A.0.jpg;  A woman with silver hair is speaking on a phone while looking directly at the viewer. The woman is wearing sunglasses and a white shirt with a big brimmed hat. She is smiling. She appears to be on a beach with a blue sky and clear water visible in the background. There is a man with grey dreadlocks behind the woman with his finger in his eye. He appears to be looking directly at the woman. yeah yeah, alright, then i'll try to find a solution. maybe you should approach her later.  above the woman's head.  The image is playful and casual. 
18.17.A.0.jpg;  The image has a building near the beach and a music note with a trail behind it.  The setting is a beach with a white sand and clear blue water. There is a tall building with a red roof behind the beach and a bright blue sky.  The image evokes a peaceful and happy feeling with a bright colour palette. The overall feel is one of joy and calm, a vacation setting where people can relax and enjoy themselves. 
19.0.B.jpg; A man with blue hair and a gold earring is visible in the image. He is looking to the left. The man has his right hand on his chin. The picture conveys a feeling of thoughtfulness and contemplation. 
19.2.B.jpg;  A cell phone, a margarita glass, and a glass of red liquid are on a table. luascans.com is in the bottom right corner of the image. The image conveys a feeling of calmness and relaxation.  
18.15.C.0.jpg; A man with dark blue hair is visible in the image. Only his face and shoulders are visible. He is wearing a dark blue jacket. He has a serious expression on his face. The man is in an outdoor setting. There is a burst of light in the background. The man is staring intensely at something in the distance.  The man looks determined and ready for a challenge. 
19.3.A.1.jpg;  The image shows a close-up of a man's arm and torso. He is wearing a blue shirt.  The text "don't worry about that. you're timothy lillywright, beloved by the world." is above the man's head and "me? i'll always be by your side. wherever you go, i'll go too." below the man's head. The image is filled with an atmosphere of confidence and assurance. 
18.17.A.1.jpg;  The image is of a beach with clear blue water. There is a music note symbol floating in the sky with a white background. The music note is floating near the top of the image.  The setting is a beach with white sand and clear blue water. There is a building in the background. The overall feeling is one of calmness and tranquility. 
19.0.C.1.jpg; A man with blue hair is wearing a white shirt, gray pants, a white bucket hat and sunglasses. He is looking to the right. He is wearing a turquoise earring in his left ear. The man has his left hand on his right shoulder. The picture conveys a feeling of joy, peace, and confidence. 
19.2.C.0.jpg; There are 3 texts in the image. The top text is saying "shh, i'm getting a call." The middle text is saying "you're not trying to change the subject, are you?" The bottom text is saying "it's my boss." The image conveys a feeling of suspicion and a sense of uneasiness. 
